{
  "version": 1,
  "status": "PROPOSED",
  "generator": "packages/spec/conformance/generate-shielded-terms.ts",
  "source": "xochi docs/planning/shielded-execution.md §7 \"Domain (terms)\" + \"ShieldedTermsV1\" (approved 2026-10-18 as a domain and a field list), Riddler#1296 (rail + fee payer, 2026-10-17)",
  "constants": {
    "aztecFieldModulus": "21888242871839275222246405745257275088548364400416034343698204186575808495617",
    "amountMax": "340282366920938463463374607431768211455",
    "domainVersion": "1",
    "termsDomainName": "Xochi Shielded Terms",
    "protocolVersion": "xochi.shielded.terms.v1",
    "settlementType": "shielded",
    "privacyLevel": "private",
    "disclosureProfileA": "recipient-private-public-amount-v1",
    "rails": [
      "a_tracer",
      "b_panel"
    ]
  },
  "domain": {
    "typeString": "EIP712Domain(string name,string version,uint256 chainId,bytes32 salt)",
    "typehash": "0xa604fff5a27d5951f334ccda7abff3286a8af29caeeb196a6f2b40a1dce7612b"
  },
  "types": {
    "encodeType": "ShieldedTermsV1(string protocolVersion,string environment,ShieldedSource source,ShieldedDestination destination,address refundAddress,uint256 refundAmount,uint64 collectBefore,uint64 settlementServiceDeadline,bytes32 recipientBindingDigest,uint32 policyRevision)NetworkIdentity(uint256 aztecChainId,uint256 protocolVersion,address rollupAddress,uint256 l1ChainId,bytes32 genesisOrNetworkDigest)ShieldedCorridor(bytes32 corridorId,uint32 corridorRevision,bytes32 manifestDigest)ShieldedDestination(string settlementType,string privacyLevel,string disclosureProfile,string rail,NetworkIdentity network,ShieldedCorridor corridor,string assetId,bytes32 aztecToken,string recipientBindingId,bytes32 descriptorDigest,bytes32 aztecRecipient,uint256 amount,bytes32 feePayer)ShieldedSource(uint256 chainId,address token,address wallet,address collector,uint256 amount)",
    "typehash": "0xce27ffd1d531f7eec3d4299ee9aae44c753155a59badc1a94d85213142df5afe",
    "source": {
      "typeString": "ShieldedSource(uint256 chainId,address token,address wallet,address collector,uint256 amount)",
      "typehash": "0xb7c4e764a5ceecbd0cc5ab5985836948bd63de70b1fea71eb7c11b3d2f20a5a2"
    },
    "corridor": {
      "typeString": "ShieldedCorridor(bytes32 corridorId,uint32 corridorRevision,bytes32 manifestDigest)",
      "typehash": "0x018f5a976811f621f1cef414a065bf1d13ee8b6aad8642efd967add017cb82c8"
    },
    "destination": {
      "encodeType": "ShieldedDestination(string settlementType,string privacyLevel,string disclosureProfile,string rail,NetworkIdentity network,ShieldedCorridor corridor,string assetId,bytes32 aztecToken,string recipientBindingId,bytes32 descriptorDigest,bytes32 aztecRecipient,uint256 amount,bytes32 feePayer)NetworkIdentity(uint256 aztecChainId,uint256 protocolVersion,address rollupAddress,uint256 l1ChainId,bytes32 genesisOrNetworkDigest)ShieldedCorridor(bytes32 corridorId,uint32 corridorRevision,bytes32 manifestDigest)",
      "typehash": "0x1ad8891313f6d171391f1a96e5cded60dab6da0321964a49d01821eb8a996f4d"
    }
  },
  "signerIsTestKey": true,
  "vectors": [
    {
      "name": "baseline",
      "recipientBinding": {
        "message": {
          "sourceWallet": "0xf39fd6e51aad88f6f4ce6ab8827279cfffb92266",
          "sourceChainId": "84532",
          "aztecRecipient": "0x1c1c1c1c1c1c1c1c1c1c1c1c1c1c1c1c1c1c1c1c1c1c1c1c1c1c1c1c1c1c1c1c",
          "aztecToken": "0x2b2b2b2b2b2b2b2b2b2b2b2b2b2b2b2b2b2b2b2b2b2b2b2b2b2b2b2b2b2b2b2b",
          "descriptorDigest": "0xd5d5d5d5d5d5d5d5d5d5d5d5d5d5d5d5d5d5d5d5d5d5d5d5d5d5d5d5d5d5d5d5",
          "corridorId": "0xc0c0c0c0c0c0c0c0c0c0c0c0c0c0c0c0c0c0c0c0c0c0c0c0c0c0c0c0c0c0c0c0",
          "corridorRevision": "1",
          "manifestDigest": "0x4d4d4d4d4d4d4d4d4d4d4d4d4d4d4d4d4d4d4d4d4d4d4d4d4d4d4d4d4d4d4d4d",
          "nonce": "0x0e0e0e0e0e0e0e0e0e0e0e0e0e0e0e0e0e0e0e0e0e0e0e0e0e0e0e0e0e0e0e0e",
          "challengeExpiry": "1899999700",
          "purpose": "xochi.shielded.recipient-binding.v1"
        },
        "digest": "0xc5e494411964b72b749254bedbe2301f06b075b7f7d7dac57b263b1e758d3a0a"
      },
      "message": {
        "protocolVersion": "xochi.shielded.terms.v1",
        "environment": "staging",
        "source": {
          "chainId": "84532",
          "token": "0x5c5c5c5c5c5c5c5c5c5c5c5c5c5c5c5c5c5c5c5c",
          "wallet": "0xf39fd6e51aad88f6f4ce6ab8827279cfffb92266",
          "collector": "0xc1c1c1c1c1c1c1c1c1c1c1c1c1c1c1c1c1c1c1c1",
          "amount": "1010000"
        },
        "destination": {
          "settlementType": "shielded",
          "privacyLevel": "private",
          "disclosureProfile": "recipient-private-public-amount-v1",
          "rail": "a_tracer",
          "network": {
            "aztecChainId": "11155111",
            "protocolVersion": "3924331020",
            "rollupAddress": "0xa1a1a1a1a1a1a1a1a1a1a1a1a1a1a1a1a1a1a1a1",
            "l1ChainId": "11155111",
            "genesisOrNetworkDigest": "0x9e9e9e9e9e9e9e9e9e9e9e9e9e9e9e9e9e9e9e9e9e9e9e9e9e9e9e9e9e9e9e9e"
          },
          "corridor": {
            "corridorId": "0xc0c0c0c0c0c0c0c0c0c0c0c0c0c0c0c0c0c0c0c0c0c0c0c0c0c0c0c0c0c0c0c0",
            "corridorRevision": "1",
            "manifestDigest": "0x4d4d4d4d4d4d4d4d4d4d4d4d4d4d4d4d4d4d4d4d4d4d4d4d4d4d4d4d4d4d4d4d"
          },
          "assetId": "aztec-testnet-test-token",
          "aztecToken": "0x2b2b2b2b2b2b2b2b2b2b2b2b2b2b2b2b2b2b2b2b2b2b2b2b2b2b2b2b2b2b2b2b",
          "recipientBindingId": "bnd_0001",
          "descriptorDigest": "0xd5d5d5d5d5d5d5d5d5d5d5d5d5d5d5d5d5d5d5d5d5d5d5d5d5d5d5d5d5d5d5d5",
          "aztecRecipient": "0x1c1c1c1c1c1c1c1c1c1c1c1c1c1c1c1c1c1c1c1c1c1c1c1c1c1c1c1c1c1c1c1c",
          "amount": "1000000",
          "feePayer": "0x0f0f0f0f0f0f0f0f0f0f0f0f0f0f0f0f0f0f0f0f0f0f0f0f0f0f0f0f0f0f0f01"
        },
        "refundAddress": "0xf39fd6e51aad88f6f4ce6ab8827279cfffb92266",
        "refundAmount": "1010000",
        "collectBefore": "1900000000",
        "settlementServiceDeadline": "1900003600",
        "policyRevision": "1",
        "recipientBindingDigest": "0xc5e494411964b72b749254bedbe2301f06b075b7f7d7dac57b263b1e758d3a0a"
      },
      "domain": {
        "name": "Xochi Shielded Terms",
        "version": "1",
        "chainId": "84532",
        "salt": "0x1e43ca16c4c6b920f5e665431e698cbd2a249686d4aefb3d13d4acf440f1aa85"
      },
      "domainSeparator": "0x3f77e30988b79ab85e8adf51140bf176227d7cf6222e1f4176f7e9f3bc23dfd9",
      "networkIdentityDigest": "0xf5046ae3e3c59d817787e4d1b3ae6d178280a4bf1b4dad404d4d31d5ca81e968",
      "sourceHash": "0x8ce360ecd21dfa6295ff1bb062194e86c6f3ba7f9df1b2fd18e6daa1712a898d",
      "corridorHash": "0x54340a98d9f551d066f87c9c75b7a9237030efe1b7ab246b5e87dd9373780604",
      "destinationHash": "0x1d99619aec506e0733be49dab2db5da04c728ac0e799eb149e1f155107f0d826",
      "structHash": "0x4157d0c15934c7a35a18382fac52ce4bfa0fbdfb73b6f3a852a278b7121dd193",
      "digest": "0x800bc75dbd8aa4806fac59f8bb7f9380315c7fa2509b6caac6089395b6a8dc99",
      "signer": "0xf39fd6e51aad88f6f4ce6ab8827279cfffb92266",
      "signature": "0x7c965569245615a53268514286a102051d7d3f17528eb50f441b26ba3d53aeac2d067153c0dcfeea8c9cecc52ba7160380a33198780af6c31681c844b057ff6e1c"
    },
    {
      "name": "other-environment",
      "recipientBinding": {
        "message": {
          "sourceWallet": "0xf39fd6e51aad88f6f4ce6ab8827279cfffb92266",
          "sourceChainId": "84532",
          "aztecRecipient": "0x1c1c1c1c1c1c1c1c1c1c1c1c1c1c1c1c1c1c1c1c1c1c1c1c1c1c1c1c1c1c1c1c",
          "aztecToken": "0x2b2b2b2b2b2b2b2b2b2b2b2b2b2b2b2b2b2b2b2b2b2b2b2b2b2b2b2b2b2b2b2b",
          "descriptorDigest": "0xd5d5d5d5d5d5d5d5d5d5d5d5d5d5d5d5d5d5d5d5d5d5d5d5d5d5d5d5d5d5d5d5",
          "corridorId": "0xc0c0c0c0c0c0c0c0c0c0c0c0c0c0c0c0c0c0c0c0c0c0c0c0c0c0c0c0c0c0c0c0",
          "corridorRevision": "1",
          "manifestDigest": "0x4d4d4d4d4d4d4d4d4d4d4d4d4d4d4d4d4d4d4d4d4d4d4d4d4d4d4d4d4d4d4d4d",
          "nonce": "0x0e0e0e0e0e0e0e0e0e0e0e0e0e0e0e0e0e0e0e0e0e0e0e0e0e0e0e0e0e0e0e0e",
          "challengeExpiry": "1899999700",
          "purpose": "xochi.shielded.recipient-binding.v1"
        },
        "digest": "0x2c87ae285e793d32c888be77309ddad16be440917656378296effb6ce37d3883"
      },
      "message": {
        "protocolVersion": "xochi.shielded.terms.v1",
        "environment": "production",
        "source": {
          "chainId": "84532",
          "token": "0x5c5c5c5c5c5c5c5c5c5c5c5c5c5c5c5c5c5c5c5c",
          "wallet": "0xf39fd6e51aad88f6f4ce6ab8827279cfffb92266",
          "collector": "0xc1c1c1c1c1c1c1c1c1c1c1c1c1c1c1c1c1c1c1c1",
          "amount": "1010000"
        },
        "destination": {
          "settlementType": "shielded",
          "privacyLevel": "private",
          "disclosureProfile": "recipient-private-public-amount-v1",
          "rail": "a_tracer",
          "network": {
            "aztecChainId": "11155111",
            "protocolVersion": "3924331020",
            "rollupAddress": "0xa1a1a1a1a1a1a1a1a1a1a1a1a1a1a1a1a1a1a1a1",
            "l1ChainId": "11155111",
            "genesisOrNetworkDigest": "0x9e9e9e9e9e9e9e9e9e9e9e9e9e9e9e9e9e9e9e9e9e9e9e9e9e9e9e9e9e9e9e9e"
          },
          "corridor": {
            "corridorId": "0xc0c0c0c0c0c0c0c0c0c0c0c0c0c0c0c0c0c0c0c0c0c0c0c0c0c0c0c0c0c0c0c0",
            "corridorRevision": "1",
            "manifestDigest": "0x4d4d4d4d4d4d4d4d4d4d4d4d4d4d4d4d4d4d4d4d4d4d4d4d4d4d4d4d4d4d4d4d"
          },
          "assetId": "aztec-testnet-test-token",
          "aztecToken": "0x2b2b2b2b2b2b2b2b2b2b2b2b2b2b2b2b2b2b2b2b2b2b2b2b2b2b2b2b2b2b2b2b",
          "recipientBindingId": "bnd_0001",
          "descriptorDigest": "0xd5d5d5d5d5d5d5d5d5d5d5d5d5d5d5d5d5d5d5d5d5d5d5d5d5d5d5d5d5d5d5d5",
          "aztecRecipient": "0x1c1c1c1c1c1c1c1c1c1c1c1c1c1c1c1c1c1c1c1c1c1c1c1c1c1c1c1c1c1c1c1c",
          "amount": "1000000",
          "feePayer": "0x0f0f0f0f0f0f0f0f0f0f0f0f0f0f0f0f0f0f0f0f0f0f0f0f0f0f0f0f0f0f0f01"